{"_D":"urn:oasis:names:specification:ubl:schema:xsd:Statement-2",
 "_A":"urn:oasis:names:specification:ubl:schema:xsd:CommonAggregateComponents-2",
 "_B":"urn:oasis:names:specification:ubl:schema:xsd:CommonBasicComponents-2",
 "Statement":[{
 "UBLVersionID":[{"_":"2.0"}],
 "CustomizationID":[{"_":"urn:oasis:names:specification:ubl:xpath:Statement-2.0:sbs-1.0-draft"}],
 "ProfileID":[{"_":"bpid:urn:oasis:names:draft:bpss:ubl-2-sbs-statement-notification-draft"}],
 "ID":[{"_":"JUL2005-07758990"}],
 "CopyIndicator":[{"_":false}],
 "UUID":[{"_":"normalizedString"}],
 "IssueDate":[{"_":"2005-08-02"}],
 "Note":[{"_":"please present invoice if this credit amount cannot be taken against a forthcoming payment"}],
 "DocumentCurrencyCode":[{"_":"GBP"}],
 "TotalDebitAmount":[{"_":0.00,
  "currencyID":"GBP"}],
 "TotalCreditAmount":[{"_":107.50,
  "currencyID":"GBP"}],
 "TotalBalanceAmount":[{"_":-107.50,
  "currencyID":"GBP"}],
 "StatementPeriod":[{
  "StartDate":[{"_":"2005-07-01"}],
  "EndDate":[{"_":"2005-07-31"}],
  "Description":[{"_":"July"}]
 }],
 "AccountingSupplierParty":[{
  "CustomerAssignedAccountID":[{"_":"CO001"}],
  "Party":[{
   "PartyName":[{
    "Name":[{"_":"Consortial"}]
   }],
   "PostalAddress":[{
    "StreetName":[{"_":"Busy Street"}],
    "BuildingName":[{"_":"Thereabouts"}],
    "BuildingNumber":[{"_":"56A"}],
    "CityName":[{"_":"Farthing"}],
    "PostalZone":[{"_":"AA99 1BB"}],
    "CountrySubentity":[{"_":"Heremouthshire"}],
    "AddressLine":[{
     "Line":[{"_":"The Roundabout"}]
    }],
    "Country":[{
     "IdentificationCode":[{"_":"GB"}]
    }]
   }],
   "PartyTaxScheme":[{
    "RegistrationName":[{"_":"Farthing Purchasing Consortium"}],
    "CompanyID":[{"_":"175 269 2355"}],
    "ExemptionReason":[{"_":"N/A"}],
    "TaxScheme":[{
     "ID":[{"_":"VAT"}],
     "TaxTypeCode":[{"_":"VAT"}]
    }]
   }],
   "Contact":[{
    "Name":[{"_":"Mrs Bouquet"}],
    "Telephone":[{"_":"0158 1233714"}],
    "Telefax":[{"_":"0158 1233856"}],
    "ElectronicMail":[{"_":"bouquet@fpconsortial.co.uk"}]
   }]
  }]
 }],
 "AccountingCustomerParty":[{
  "CustomerAssignedAccountID":[{"_":"XFB01"}],
  "SupplierAssignedAccountID":[{"_":"GT00978567"}],
  "Party":[{
   "PartyName":[{
    "Name":[{"_":"IYT Corporation"}]
   }],
   "PostalAddress":[{
    "StreetName":[{"_":"Avon Way"}],
    "BuildingName":[{"_":"Thereabouts"}],
    "BuildingNumber":[{"_":"56A"}],
    "CityName":[{"_":"Bridgtow"}],
    "PostalZone":[{"_":"ZZ99 1ZZ"}],
    "CountrySubentity":[{"_":"Avon"}],
    "AddressLine":[{
     "Line":[{"_":"3rd Floor, Room 5"}]
    }],
    "Country":[{
     "IdentificationCode":[{"_":"GB"}]
    }]
   }],
   "PartyTaxScheme":[{
    "RegistrationName":[{"_":"Bridgtow District Council"}],
    "CompanyID":[{"_":"12356478"}],
    "ExemptionReason":[{"_":"Local Authority"}],
    "TaxScheme":[{
     "ID":[{"_":"UK VAT"}],
     "TaxTypeCode":[{"_":"VAT"}]
    }]
   }],
   "Contact":[{
    "Name":[{"_":"Mr Fred Churchill"}],
    "Telephone":[{"_":"0127 2653214"}],
    "Telefax":[{"_":"0127 2653215"}],
    "ElectronicMail":[{"_":"fred@iytcorporation.gov.uk"}]
   }]
  }]
 }],
 "PayeeParty":[{
  "PartyName":[{
   "Name":[{"_":"Consortial"}]
  }],
  "PostalAddress":[{
   "StreetName":[{"_":"Busy Street"}],
   "BuildingName":[{"_":"Thereabouts"}],
   "BuildingNumber":[{"_":"56A"}],
   "CityName":[{"_":"Farthing"}],
   "PostalZone":[{"_":"AA99 1BB"}],
   "CountrySubentity":[{"_":"Heremouthshire"}],
   "AddressLine":[{
    "Line":[{"_":"The Roundabout"}]
   }],
   "Country":[{
    "IdentificationCode":[{"_":"GB"}]
   }]
  }],
  "PartyTaxScheme":[{
   "RegistrationName":[{"_":"Farthing Purchasing Consortium"}],
   "CompanyID":[{"_":"175 269 2355"}],
   "ExemptionReason":[{"_":"N/A"}],
   "TaxScheme":[{
    "ID":[{"_":"VAT"}],
    "TaxTypeCode":[{"_":"VAT"}]
   }]
  }],
  "Contact":[{
   "Name":[{"_":"Mrs Bouquet"}],
   "Telephone":[{"_":"0158 1233714"}],
   "Telefax":[{"_":"0158 1233856"}],
   "ElectronicMail":[{"_":"bouquet@fpconsortial.co.uk"}]
  }]
 }],
 "PaymentMeans":[{
  "PaymentMeansCode":[{"_":"20"}],
  "PaymentDueDate":[{"_":"2005-07-21"}],
  "PayeeFinancialAccount":[{
   "ID":[{"_":"12345678"}],
   "Name":[{"_":"Farthing Purchasing Consortium"}],
   "AccountTypeCode":[{"_":"Current"}],
   "CurrencyCode":[{"_":"GBP"}],
   "FinancialInstitutionBranch":[{
    "ID":[{"_":"10-26-58"}],
    "Name":[{"_":"Open Bank Ltd, Bridgstow Branch "}],
    "FinancialInstitution":[{
     "ID":[{"_":"10-26-58"}],
     "Name":[{"_":"Open Bank Ltd"}],
     "Address":[{
      "StreetName":[{"_":"City Road"}],
      "BuildingName":[{"_":"Banking House"}],
      "BuildingNumber":[{"_":"12"}],
      "CityName":[{"_":"London"}],
      "PostalZone":[{"_":"AQ1 6TH"}],
      "CountrySubentity":[{"_":"London\n"}],
      "AddressLine":[{
       "Line":[{"_":"5th Floor"}]
      }],
      "Country":[{
       "IdentificationCode":[{"_":"GB"}]
      }]
     }]
    }],
    "Address":[{
     "StreetName":[{"_":"Busy Street"}],
     "BuildingName":[{"_":"The Mall"}],
     "BuildingNumber":[{"_":"152"}],
     "CityName":[{"_":"Farthing"}],
     "PostalZone":[{"_":"AA99 1BB"}],
     "CountrySubentity":[{"_":"Heremouthshire"}],
     "AddressLine":[{
      "Line":[{"_":"West Wing"}]
     }],
     "Country":[{
      "IdentificationCode":[{"_":"GB"}]
     }]
    }]
   }],
   "Country":[{
    "IdentificationCode":[{"_":"GB"}]
   }]
  }]
 }],
 "PaymentTerms":[{
  "Note":[{"_":"Payment due immediately"}]
 }],
 "StatementLine":[{
  "ID":[{"_":"normalizedString"}],
  "Note":[{"_":"String"}],
  "BalanceBroughtForwardIndicator":[{"_":false}],
  "DebitLineAmount":[{"_":0.00,
   "currencyID":"GBP"}],
  "CreditLineAmount":[{"_":107.50,
   "currencyID":"GBP"}],
  "BalanceAmount":[{"_":-107.50,
   "currencyID":"GBP"}],
  "OriginatorCustomerParty":[{
   "Party":[{
    "PartyName":[{
     "Name":[{"_":"The Terminus"}]
    }],
    "PostalAddress":[{
     "StreetName":[{"_":"Avon Way"}],
     "BuildingName":[{"_":"Thereabouts"}],
     "BuildingNumber":[{"_":"56A"}],
     "CityName":[{"_":"Bridgtow"}],
     "PostalZone":[{"_":"ZZ99 1ZZ"}],
     "CountrySubentity":[{"_":"Avon"}],
     "AddressLine":[{
      "Line":[{"_":"3rd Floor, Room 5"}]
     }],
     "Country":[{
      "IdentificationCode":[{"_":"GB"}]
     }]
    }],
    "PartyTaxScheme":[{
     "RegistrationName":[{"_":"Bridgtow District Council"}],
     "CompanyID":[{"_":"12356478"}],
     "ExemptionReason":[{"_":"Local Authority"}],
     "TaxScheme":[{
      "ID":[{"_":"UK VAT"}],
      "TaxTypeCode":[{"_":"VAT"}]
     }]
    }],
    "Contact":[{
     "Name":[{"_":"S Massiah"}],
     "Telephone":[{"_":"0127 98876545"}],
     "Telefax":[{"_":"0127 98876546"}],
     "ElectronicMail":[{"_":"smassiah@the-email.co.uk"}]
    }]
   }]
  }],
  "BillingReference":[{
   "CreditNoteDocumentReference":[{
    "ID":[{"_":"CN758494"}],
    "UUID":[{"_":"349ABBAE-DF9D-40B4-849F-94C5FF9D1AF4"}],
    "IssueDate":[{"_":"2005-06-25"}]
   }]
  }]
 }]
}]}